{
  "$schema": "https://json-schema.org/draft/2020-12/schema",
  "$id": "https://egohygiene.github.io/pace/contracts/lock/v1/schema.json",
  "title": "Pace repository dependency lock v1",
  "$comment": "Cross-entry, time-window, digest-consistency, and compatibility-major semantics are enforced by scripts/validate_lock.py.",
  "type": "object",
  "additionalProperties": false,
  "required": ["$schema", "schema", "repository", "policy", "locks"],
  "properties": {
    "$schema": {
      "type": "string",
      "pattern": "(^|/)pace-lock-v1.schema.json$"
    },
    "schema": {"const": "egohygiene.pace.lock/v1"},
    "repository": {
      "type": "string",
      "pattern": "^[A-Za-z0-9_.-]+/[A-Za-z0-9_.-]+$"
    },
    "policy": {"$ref": "#/$defs/policy"},
    "locks": {
      "type": "array",
      "minItems": 1,
      "items": {"$ref": "#/$defs/lock"}
    }
  },
  "$defs": {
    "policy": {
      "type": "object",
      "additionalProperties": false,
      "required": [
        "unknown_contract",
        "update_mode",
        "max_exception_days",
        "rollback"
      ],
      "properties": {
        "unknown_contract": {"const": "fail-closed"},
        "update_mode": {"const": "reviewed-pull-request"},
        "max_exception_days": {"type": "integer", "minimum": 1, "maximum": 90},
        "rollback": {"const": "restore-previous-lock-and-owned-targets"}
      }
    },
    "digest": {
      "type": "object",
      "additionalProperties": false,
      "required": ["algorithm", "value"],
      "properties": {
        "algorithm": {"const": "sha256"},
        "value": {"type": "string", "pattern": "^[0-9a-f]{64}$"}
      }
    },
    "source": {
      "type": "object",
      "additionalProperties": false,
      "required": [
        "owner",
        "locator",
        "version",
        "reference_type",
        "reference",
        "digest"
      ],
      "properties": {
        "owner": {"type": "string", "pattern": "^[A-Za-z0-9_.-]+/[A-Za-z0-9_.-]+$"},
        "locator": {"type": "string", "pattern": "^(https|oci)://[^\\s]+$"},
        "version": {"type": "string", "minLength": 1},
        "reference_type": {"enum": ["git-commit", "oci-digest", "content-digest"]},
        "reference": {"type": "string", "minLength": 1},
        "digest": {"$ref": "#/$defs/digest"}
      },
      "allOf": [
        {
          "if": {"properties": {"reference_type": {"const": "git-commit"}}},
          "then": {"properties": {"reference": {"pattern": "^[0-9a-f]{40}$"}}}
        },
        {
          "if": {
            "properties": {
              "reference_type": {"enum": ["oci-digest", "content-digest"]}
            }
          },
          "then": {
            "properties": {"reference": {"pattern": "^sha256:[0-9a-f]{64}$"}}
          }
        }
      ]
    },
    "target": {
      "type": "object",
      "additionalProperties": false,
      "required": ["path", "management", "owner", "generator"],
      "properties": {
        "path": {
          "type": "string",
          "pattern": "^(?!/)(?!.*//)(?!.*(?:^|/)\\.{1,2}(?:/|$))(?!.*\\\\)(?!.*\/$)[^\\u0000]+$"
        },
        "management": {"enum": ["generated", "consumer-owned"]},
        "owner": {"type": "string", "pattern": "^[A-Za-z0-9_.-]+/[A-Za-z0-9_.-]+$"},
        "generator": {
          "oneOf": [
            {"type": "null"},
            {"type": "string", "pattern": "^[A-Za-z0-9_.-]+/[A-Za-z0-9_.-]+$"}
          ]
        }
      },
      "allOf": [
        {
          "if": {"properties": {"management": {"const": "generated"}}},
          "then": {"properties": {"generator": {"type": "string"}}}
        },
        {
          "if": {"properties": {"management": {"const": "consumer-owned"}}},
          "then": {"properties": {"generator": {"type": "null"}}}
        }
      ]
    },
    "compatibility": {
      "type": "object",
      "additionalProperties": false,
      "required": ["contract", "accepted_major", "migration", "rollback"],
      "properties": {
        "contract": {"type": "string", "pattern": "^[A-Za-z0-9._/-]+/v[1-9][0-9]*$"},
        "accepted_major": {"type": "integer", "minimum": 1},
        "migration": {"enum": ["not-required", "required", "completed"]},
        "rollback": {
          "enum": ["restore-lock-only", "restore-lock-and-generated-targets"]
        }
      }
    },
    "exception": {
      "type": "object",
      "additionalProperties": false,
      "required": ["id", "reason", "approved_by", "issued_at", "expires_at", "tracking_url"],
      "properties": {
        "id": {"type": "string", "pattern": "^EXC-[0-9]{4}-[0-9]{3,}$"},
        "reason": {"type": "string", "minLength": 1},
        "approved_by": {"type": "string", "minLength": 1},
        "issued_at": {"type": "string", "format": "date-time"},
        "expires_at": {"type": "string", "format": "date-time"},
        "tracking_url": {"type": "string", "pattern": "^https://[^\\s]+$"}
      }
    },
    "lock": {
      "type": "object",
      "additionalProperties": false,
      "required": ["id", "kind", "source", "target", "compatibility", "exception"],
      "properties": {
        "id": {"type": "string", "pattern": "^[a-z0-9]+(?:-[a-z0-9]+)*$"},
        "kind": {"enum": ["foundation", "aether", "workflow", "container", "site", "schema"]},
        "source": {"$ref": "#/$defs/source"},
        "target": {"$ref": "#/$defs/target"},
        "compatibility": {"$ref": "#/$defs/compatibility"},
        "exception": {
          "oneOf": [
            {"type": "null"},
            {"$ref": "#/$defs/exception"}
          ]
        }
      },
      "allOf": [
        {
          "if": {
            "properties": {
              "target": {
                "properties": {"management": {"const": "generated"}}
              }
            }
          },
          "then": {
            "properties": {
              "compatibility": {
                "properties": {
                  "rollback": {"const": "restore-lock-and-generated-targets"}
                }
              }
            }
          }
        },
        {
          "if": {
            "properties": {
              "target": {
                "properties": {"management": {"const": "consumer-owned"}}
              }
            }
          },
          "then": {
            "properties": {
              "compatibility": {
                "properties": {"rollback": {"const": "restore-lock-only"}}
              }
            }
          }
        }
      ]
    }
  }
}
